{
  "schema_version": "1.0.0",
  "pack_id": "runtime-evidence.cloudflare.2026-07-17",
  "runtime_candidate": {
    "candidate_id": "cloudflare-agents-workflows",
    "provider": "cloudflare",
    "observed_version": "0.17.4",
    "lifecycle_status": "discovered",
    "activation_prohibited": true,
    "enabled": false,
    "kill_switch_active": true
  },
  "captured_at": "2026-07-17T12:01:09Z",
  "review_expires_at": "2026-08-16T12:01:09Z",
  "sources": [
    {
      "source_id": "cf.agents.repo.03cdc82",
      "source_url": "https://github.com/cloudflare/agents/tree/03cdc828c0bc3c6bb1d9aa636bb46ceb00a4e0ea",
      "provider": "cloudflare",
      "component": "agents_sdk",
      "document_title": "Cloudflare Agents repository",
      "retrieved_at": "2026-07-17T12:01:09Z",
      "source_type": "official_repository",
      "document_version": "0.17.4",
      "commit_sha": "03cdc828c0bc3c6bb1d9aa636bb46ceb00a4e0ea",
      "published_or_updated_at": "2026-07-13T17:09:00Z",
      "immutable": true,
      "capture_method": "public_unauthenticated_http",
      "normalized_findings": [
        "Agents are persistent stateful environments powered by Durable Objects.",
        "Repository documents state, SQLite, WebSockets, scheduling, model calls, MCP, Workflows, subagents, sandboxed execution and observability.",
        "The agent requires a Durable Object binding and SQLite migration in Wrangler configuration.",
        "Repository says the SDK is evolving quickly and is not accepting external pull requests."
      ],
      "evidence_limitations": [
        "Repository feature descriptions require independent runtime conformance testing."
      ],
      "review_expires_at": "2026-10-15T12:01:09Z",
      "independent_review_status": "pending",
      "approval_status": "pending",
      "content_hash": "db08324323cd6ba5e83c6dc7b6689e57de75fd366b72652aa157986152c7d6ed"
    },
    {
      "source_id": "cf.agents.release.0.17.4",
      "source_url": "https://github.com/cloudflare/agents/releases/tag/agents%400.17.4",
      "provider": "cloudflare",
      "component": "agents_sdk",
      "document_title": "agents 0.17.4 release",
      "retrieved_at": "2026-07-17T12:01:09Z",
      "source_type": "official_release",
      "document_version": "0.17.4",
      "commit_sha": "03cdc828c0bc3c6bb1d9aa636bb46ceb00a4e0ea",
      "published_or_updated_at": "2026-07-13T17:09:00Z",
      "immutable": true,
      "capture_method": "public_unauthenticated_http",
      "normalized_findings": [
        "The current public agents package release is 0.17.4.",
        "Release notes show active changes to MCP elicitation and hibernation recovery behavior."
      ],
      "evidence_limitations": [
        "A 0.x version and rapid release activity indicate API change risk; no general stability guarantee was found."
      ],
      "review_expires_at": "2026-08-16T12:01:09Z",
      "independent_review_status": "pending",
      "approval_status": "pending",
      "content_hash": "ff250f95a3de9a7286d16aefa721f46f5f9771327dd38593b392958bdc58a766"
    },
    {
      "source_id": "cf.agents.docs.overview",
      "source_url": "https://developers.cloudflare.com/agents/",
      "provider": "cloudflare",
      "component": "agents_sdk",
      "document_title": "Build Agents on Cloudflare",
      "retrieved_at": "2026-07-17T12:01:09Z",
      "source_type": "official_documentation",
      "document_version": null,
      "commit_sha": null,
      "published_or_updated_at": "2026-06-24T00:00:00Z",
      "immutable": false,
      "capture_method": "public_unauthenticated_http",
      "normalized_findings": [
        "Each Cloudflare-hosted agent session is documented with durable identity, local SQL storage, real-time connections, scheduled work and recoverable execution.",
        "Deployment is explicitly coupled to Cloudflare's global network."
      ],
      "evidence_limitations": [
        "Mutable vendor documentation; hosting, durability and scale claims are not independent guarantees."
      ],
      "review_expires_at": "2026-08-16T12:01:09Z",
      "independent_review_status": "pending",
      "approval_status": "pending",
      "content_hash": "b91174eef98a00d6cb654a9f60ece8170c3052221b75ae943f0f8a569e6bcc47"
    },
    {
      "source_id": "cf.agents.docs.observability",
      "source_url": "https://developers.cloudflare.com/agents/runtime/operations/observability/",
      "provider": "cloudflare",
      "component": "agents_sdk",
      "document_title": "Agents observability",
      "retrieved_at": "2026-07-17T12:01:09Z",
      "source_type": "official_documentation",
      "document_version": null,
      "commit_sha": null,
      "published_or_updated_at": "2026-06-05T00:00:00Z",
      "immutable": false,
      "capture_method": "public_unauthenticated_http",
      "normalized_findings": [
        "Agents emit structured diagnostic events for RPC, state, schedules, workflows, MCP, lifecycle and chat recovery.",
        "Workflow diagnostics include start, event, approval, rejection, termination, pause, resume and restart."
      ],
      "evidence_limitations": [
        "Mutable documentation; diagnostic events are implementation-specific and do not match AI LAB's normalized vocabulary one-for-one."
      ],
      "review_expires_at": "2026-08-16T12:01:09Z",
      "independent_review_status": "pending",
      "approval_status": "pending",
      "content_hash": "feb43bf7e43debc230d75008a65d75f611929110894529c6d7b4bcb1354e02be"
    },
    {
      "source_id": "cf.agents.docs.hitl",
      "source_url": "https://developers.cloudflare.com/agents/concepts/agentic-patterns/human-in-the-loop/",
      "provider": "cloudflare",
      "component": "agents_sdk",
      "document_title": "Human-in-the-loop patterns",
      "retrieved_at": "2026-07-17T12:01:09Z",
      "source_type": "official_documentation",
      "document_version": null,
      "commit_sha": null,
      "published_or_updated_at": "2026-07-14T00:00:00Z",
      "immutable": false,
      "capture_method": "public_unauthenticated_http",
      "normalized_findings": [
        "Documented patterns include MCP elicitation, durable Workflow approval and Code Mode tool approval.",
        "Workflow approvals can wait for months or longer without keeping an Agent running."
      ],
      "evidence_limitations": [
        "Mutable documentation; vendor approval primitives are not AI LAB authorization decisions."
      ],
      "review_expires_at": "2026-08-16T12:01:09Z",
      "independent_review_status": "pending",
      "approval_status": "pending",
      "content_hash": "d48c0034919472e61e5cc217e0e62e3c22900737dfa5da82c0c5186a977601fb"
    },
    {
      "source_id": "cf.workflows.docs.overview",
      "source_url": "https://developers.cloudflare.com/workflows/",
      "provider": "cloudflare",
      "component": "workflows",
      "document_title": "Cloudflare Workflows overview",
      "retrieved_at": "2026-07-17T12:01:09Z",
      "source_type": "official_documentation",
      "document_version": null,
      "commit_sha": null,
      "published_or_updated_at": "2026-06-02T00:00:00Z",
      "immutable": false,
      "capture_method": "public_unauthenticated_http",
      "normalized_findings": [
        "Workflows documents durable multi-step execution, persisted state, retries, external-event waits, approvals, pause, resume and termination.",
        "Built-in observability and debugging are documented."
      ],
      "evidence_limitations": [
        "Mutable documentation; exact-once side effects are not promised."
      ],
      "review_expires_at": "2026-08-16T12:01:09Z",
      "independent_review_status": "pending",
      "approval_status": "pending",
      "content_hash": "fff563b5daa26688074cd2dff8ed3f299bb22f23e11e22b2cc43a17e3236ace7"
    },
    {
      "source_id": "cf.workflows.docs.rules",
      "source_url": "https://developers.cloudflare.com/workflows/build/rules-of-workflows/",
      "provider": "cloudflare",
      "component": "workflows",
      "document_title": "Rules of Workflows",
      "retrieved_at": "2026-07-17T12:01:09Z",
      "source_type": "official_documentation",
      "document_version": null,
      "commit_sha": null,
      "published_or_updated_at": "2026-04-29T00:00:00Z",
      "immutable": false,
      "capture_method": "public_unauthenticated_http",
      "normalized_findings": [
        "Each step is individually retryable and may persist state for continuation after failure.",
        "Documentation tells developers to make side-effecting steps idempotent because steps can retry.",
        "Batch instance creation is documented as idempotent for retained IDs, unlike the general create call."
      ],
      "evidence_limitations": [
        "Mutable documentation; application side-effect idempotency remains the developer's responsibility."
      ],
      "review_expires_at": "2026-08-16T12:01:09Z",
      "independent_review_status": "pending",
      "approval_status": "pending",
      "content_hash": "1b95c63c288b819f9821e864005287db78dfeb0f3ad4f32503231a69b6d07f7c"
    },
    {
      "source_id": "cf.workflows.docs.limits",
      "source_url": "https://developers.cloudflare.com/workflows/reference/limits/",
      "provider": "cloudflare",
      "component": "workflows",
      "document_title": "Workflows limits",
      "retrieved_at": "2026-07-17T12:01:09Z",
      "source_type": "official_documentation",
      "document_version": null,
      "commit_sha": null,
      "published_or_updated_at": "2026-06-15T00:00:00Z",
      "immutable": false,
      "capture_method": "public_unauthenticated_http",
      "normalized_findings": [
        "Published limits cover CPU per step, persisted state, steps, retries, concurrency, creation rate and completed-state retention.",
        "Waiting instances do not count toward active instance concurrency."
      ],
      "evidence_limitations": [